I am curious to learn more about the Corona virus?,how coronavirus began,do coronaviruses cause the common cold,I have a body ache.,How do I get help from the authorities?,How do I avoid contracting or spreading the virus,can the corona virus live dormant in your body,does hydroxychloroquine cure corona virus,is corona virus a bio weapon,Can the virus be spread through sex?,,,,,,,,,
I am eager to know what coronavirus is,how coronavirus started,do covid-19 tests work,"I have a chronic illness and I have flu like symptoms, should I be concerned",How do I get help if I have the Corona virus?,How do I avoid covid-19?,can the corona virus survive in the cold,Does ibuprofen make the virus worse?,is corona virus a lab leak,Can the virus spread from animals to humans?,,,,,,,,,
I am not sure if corona virus is dangerous,how coronavirus starts,do I experience chest pains if I am infected with corona virus,I have a cough,How do I get help?,How do I clean my hands properly?,can vegans get corona virus,Does the tuberculosis shot help with preventing the virus?,Is corona virus caused by 5G?,Can you get corona virus from corona beer?,,,,,,,,,
I am quite eager to learn about this Covid19 virus.,how covid-19 started,Do people get body pain when infected with covid-19?,"I have a cough, runny nose and fever.",How do I get in touch regarding COVID-19?,How do I keep my mask clean?,can you die from corona virus,Has anyone taken any medicine that has helped with the virus so far?,is coronavirus a hoax,Can you show me how is the virus spreading?,,,,,,,,,
I am seeking general information about COVID-19.,how did corona virus begin,Do people have a sore throat if infected with covid-19?,I have a cough.,How do i know where to go for the corona virus?,How do I prevent the spread of the virus,can you get arrested for joking about the corona virus,Have medicine been tested on Corona virus patients shown successful?,is coronavirus real,Coronavirus and speaking.,,,,,,,,,
I am wondering about covid-19.,How did corona virus begin?,Do people infected with coronavirus ever get a sore throat?,"I have a dry cough for over a week, do I have the virus?",How do i know who my emergency contact is for the corona virus?,How do I protect myself and my family from contracting the Corona virus?,can you get corona virus froma chinese product,How can I choose the right medication to take?,Is covid-19 a biomedical weapon?,Coronavirus in droplets.,,,,,,,,,
I am wondering what corona virus is.,how did corona virus come up,Do people infected with coronavirus ever get headaches?,I have a dry cough.,How do I reach out for help?,How do I protect myself and my family from covid-19,can you get reinfected by the corona virus,How can I find out which medication can be used?,Is Covid-19 a Chinese virus?,Coronavirus person to person transmission.,,,,,,,,,
I am wondering what coronavirus is,how did corona virus develop,Do the symptoms include cough?,I have a fever do i have Corona virus?,How do we reach out to relevant authorities during the pandemic?,How do I put on a face mask?,can you get reinfected with the corona virus,how has the covid 19 vaccine effected the test subjects,Is COVID-19 Chinese?,Coronavirus transmissions.,,,,,,,,,
I corona virus real?,how did corona virus start,Do the symptoms include fever?,I have a flemmy cough.,I am wondering which number should I call,How do I stop coronavirus?,can you get the corona virus from drinking corona,how is the covid 19 treatable,is covid-19 man made,Could you tell me how COVID-19 is spreading?,,,,,,,,,
I need help understanding corona virus,how did coronavirus begin,Do the symptoms of COVID-19 differ from the flu?,I have a headache,I need a phone number to call,How do I stop the spread?,can you get the corona virus from inside boxes,How is the virus treated?,Is Covid-19 part of population control?,Covid19 and its transmission.,,,,,,,,,
I need information about corona virus,How did coronavirus emerge?,Do you constantly sneeze when infected with corona virus?,I have a headache.,I need contact information for an emergency,How do you not get covid 19?,can you get the corona virus from inside boxesw,How much medication do I take for the virus?,is covid-19 real,Covid19 and meat based transmission.,,,,,,,,,
I need more details about the Corona virus.,How did Covid begin?,Do you experience high fever with corona virus?,I have a high fever,I need the numbers to call.,How do you prevent the corona virus?,Can you give me information about the number of cases?,how much vaccine do we have for covid 19,Is Covid-19 World War III?,Covid19 can be spread from proximity to all infected living beings.,,,,,,,,,
I need to understand more about corona virus,How did Covid originate?,Do you get a dry cough with corona virus?,I have a high fever.,I want to know how I can reach emergency contacts.,How does one ensure they don't catch it?,can you have corona virus twice,how much willl the covid 19 vaccine cost,is it true corona virus does not effect caucasians,Covid19 contact tracing and avoiding hand shakes.,,,,,,,,,
I need you to Explain corona virus or Covid-19.,How did Covid start?,Do you have information about the symptoms?,I have a higher than normal fever.,I want to know what emergency lines are active in case of having the virus symptoms.,How far away from another person should I stay?,can you take chemo if you have corona virus,how much would the corona virus medicine cost,Is it true that weather affects the spread of the virus so things will be alright when summer arrives?,Covid19 greetings and dietary supplements to boost the immunity.,,,,,,,,,
I want information on COVID-19.,How did COVID-19 come about?,Do you know if cough is normal in corona virus?,I have a running nose covid19.,I want to learn if there is a telephone number,How far away should I stand from other people?,Can you tell me how many people have been infected?,How often can I take flu medication?,is the corona virus a communist propaganda,Covid19 human to human transmission.,,,,,,,,,
I want official information about covid-19,How did COVID-19 come into existence?,Do you know if diarrhea is normal in COVID-19?,I have a runny nose and headache,I want to learn if there is an email address,How much time to change the sanitiser brand?,Can you tell me what the current number of cases is?,How soon will a vaccine be available?,Is the corona virus Chinese?,Covid19 is a zoonotic virus meaning it can jump intra species of pets in home or wild from remote.,,,,,,,,,
I want some information about corona virus.,How did COVID-19 come to be?,Do you know if the corona virus compromises the respiratory system?,I have a runny nose.,I want to learn what number should I call.,How often can I leave the house?,can you travel to hong kong corona virus,how soon will corona virus vaccine be available,is the corona virus immune to african american,Covid19 is known to be caused from the infected droplets of the affected covid19 person.,,,,,,,,,
I want to know about corona virus?,How did covid-19 emerge?,Do you know if the symptoms of COVID-19 consistent?,I have a severe sore throat,"If I have Covid symptoms, who should I call?",How often should I wash my hands,Corona and its growth.,how to cure corona virus orange county,Is the government hiding information about spread of Corona?,Covid19 precautions involve avoiding all forms of physical greetings and proximity anf if possible to have atleast 6 feet distance manitained.,,,,,,,,,
I want to know about coronavirus.,How did the Corona Virus come about?,Do you know the consistent symptoms of COVID-19,I have a sore throat and fever.,"In case of any emergency, you can call 719 for help",How often should I wash my hands?,Corona and its remergence.,how to cure corona virus with essential oils,Is there a correlation between 5G and a weakened immune system?,"Covid19 precautions involves changing masks twice a day , avoiding sneezing , and spitting and regular sanitising hands and personal workplace.",,,,,,,,,
I want to know about Covid,How did the coronavirus come to be?,Do you know the symptoms of a person with the virus?,"I have a sore throat, is that corona?",Is there a hotline for the corona virus?,how to avoid catching corona virus,Corona and the number of deaths.,Hydoxychloroquinine effects on children.,Look up '5G' and 'COVID-19',Do animals give you corona virus?,,,,,,,,,
I want to know about covid-19.,How did the COVID-19 virus begin?,Do you know what the symptoms of covid-19 are?,I have a sore throat.,Is there a list of websites that can provide accurate information,how to avoid cathcing corona virus,Corona dashboard.,Hydroxychloquinine mal effects.,Look up 'corona virus' and 'conspiracy.',do coronavirus droplets linger in the air,,,,,,,,,
I want to know everything about corona virus.,How did the virus arise?,Does being extremely tired mean I have Corona?,I have a stomachache,Is there a number I should call if I have the Corona virus?,How to keep our surrounding clean from corona?,Corona fatalities.,I am wondering how do I find treatmen for Covid19. ,Look up 'Zoom' and 'COVID-19',do coronaviruses like hot weather,,,,,,,,,
I want to know more about corona virus,How did the virus come about originally?,does coronavirus affect blood type,"I have a very bad cough, could that be from the virus?",Is there a phone number I can call if I have questions?,How to prevent corona virus,Corona in ASIA.,I don't believe that medicine should be used without credible evidence of cure.,Real versus false facts about corona,Do mosquitos transmit it?,,,,,,,,,
I want to know more about coronavirus,How did the virus come about?,does coronavirus affect children,I have an abnormally high body temperature,Is there a specific hospital I should call?,how to prevent geting the corona virus,Corona in EUROPE.,I heard ibuprofen can be dangerous against covid-19. How can I find out if that's accurate?,Search 'coronavirus hoax' for me,Do pets like dogs or cats spread the virus,,,,,,,,,
I want to know more COVID-19,How did the virus come into being?,does coronavirus affect the eyes,"I have asthma, does it mask a potential symptom?",Is there a toll-free number I can contact?,how to protect elder from corona virus,Corona news.,I need information on the medicines that can be used for corona,Search 'coronavirus myths' for me,Do we know for certain that mosquitoes cannot spread the virus?,,,,,,,,,
I want to know more information about corona virus,How did the virus come to be,does coronavirus always have fever,I have back pain covid19.,Is there also an email address for the local authorities?,How to regularly clean hands?,Corona number of cases and deaths.,I want information that cannot be used for corona,Should I take hot baths?,Do you know how is the virus spreading?,,,,,,,,,
I want to know what corona virus is,How did the virus come to exist?,does coronavirus cause a rash,I have bad taste covid19.,Is there an e-mail I can contact for questions?,"How to stay safe from Covid19",Corona outbreak and its numbers.,I want to know what medicines can be used.,Show me examples of disinformation about covid-19,Do you know how it spreads,,,,,,,,,
I want to know what covid-19 is.,How did the virus come up,does coronavirus cause chest pain,I have been feverish for the past few days.,Is there any number that I can call to,how to stop corona virus,Corona positive cases.,I want to know what the doctors' recommendations are.,Show me false information that is being spread about Covid-19.,Do you know how the Corona Virus is transmitted?,,,,,,,,,
I want to know what is corona,how did the virus start,does coronavirus cause diarrhea,I have been in contact with someone who is positive and now i have a cough.,Is there any way to contact the authorities in case I have Covid19?,I am curious about how to protect myself against covid-19.,Corona rates and its speed.,I want to learn about the medication that can be taken for Covid-19.,Show me myths about Covid19,Do you know how the virus spreads?,,,,,,,,,
I want to learn about coronavirus.,How did the virus start?,does coronavirus cause headache,I have been in contact with someone who teste positive but have no symptoms.,Is this the only means of contacting our authorities?,I am wondering how I can protect myself from coronavirus.,Corona trajectory.,I want to learn how to find Covid19 treatment.,Tell me fake news about Corona,Do you know the virus can be transferred?,,,,,,,,,
I want to learn about Covid19.,How is coronavirus spreading?,does coronavirus cause pneumonia,I have body ache.,Look up who to contact to report a person under suspicion.,I am wondering if wearing a mask is effective in preventing coronavirus,Coronavirus fatalities.,Is acetaminophen a good medicine to help with the fever?,Tell me more about the myths surrounding covid-19.,Does corona virus spread through the exchange of bodily fluids?,,,,,,,,,
I want to learn about covid-19.,How is COVID-19 different from other diseases?,does coronavirus cause sore throat,I have breathing difficulty.,Please tell me a pone number to contact.,I am wondering what steps can I take to stay safe from Covid19? ,could i hav the corona virus,Is chloroquine effective against covid?,was corona virus being weaponized,does coronavirus live in the air,,,,,,,,,
I want to learn about the Novel Coronavirus disease.,How long has Covid19 been around?,does coronavirus cause vomiting,I have chills. Do I have covid-19?,Please tell me who to call if I wish to get tested for COVID-19.,I can say for sure I am doing my part to stop the spread of Covid19?,could the usa go on lockdown corona virus,Is COVID-19 incurable?,was corona virus from a lab,does coronavirus live in water,,,,,,,,,
I want to learn more about corona virus.,how the corona virus was created,does coronavirus make you vomit,I have congestion and a fever,Search for me 'phone number medic',I want to know if washing my hands is the best way to protect myself against the coronavirus.,Could you tell me how many people infected are?,Is Ibuprofen okay to use if you are worried about corona virus?,Was corona virus made in a lab?,does coronavirus live on clothes,,,,,,,,,
I want to learn more about COVID-19.,how to corona virus start,does coronavirus start with sore throat,I have cough,Search for the corona virus emergency contact information.,I want to know more about the precautions,Could you tell me how many people were infected today?,Is it bad to take flu medication if I worry that I have corona virus?,Was corona virus made in the lab,does coronavirus live on clothing,,,,,,,,,
I want to learn more about COVID-19?,How was corona virus created?,Does coughing mean I have Coronavirus?,I have developed the following symptoms: cough and fever.,Search for the emergency contact information for corona virus related cases.,I want to know the best protocol to avoid the virus.,Covid19 effected places.,Is it necessary to take medicines?,was coronavirus a bioweapon,does coronavirus live on fabric,,,,,,,,,
I want to learn more about the Corona Virus,I am curious about the origins of the corona virus.,does covid-19 always cause fever,"I have dry cough, do I need to go for check up.",Should I call if I think I have the corona virus?,I want to know what precautions to take against getting the virus.,Covid19 post wuhan facts.,Is it okay to take medicine for a headache?,was coronavirus bioengineered,does coronavirus live on food,,,,,,,,,
I want to see a description of COVID-19,I am wondering how covid-19 emerged,does covid-19 cause blood clots,"I have eyes swelling covid19.
I have headaches covid19.
I have sore throat covid19.",Should i call someone?,I want to know what precautions to take to avoid getting the virus.,daily stats for infection,Is it safe to use ibuprofen if I have corona virus,was coronavirus created,does coronavirus live on paper,,,,,,,,,
I was wondering if you can teach me more about Covid19?,I am wondering what caused the corona virus?,does covid-19 cause diarrhea,I have fatigue,Should I email or call the authorities if I suspect I have the corona virus?,I want to learn about some of the ways to avoid catching coronavirus.,de donde a salido el corona virus,Is Paracetamol recommended?,was coronavirus created in lab,does coronavirus live on surfaces,,,,,,,,,
I was wondering what can I do to learn more about Corona virus?,I am wondering what kind of virus causes Covid19. ,does covid-19 cause heart attacks,"I have flu like symptoms and body aches, do I have covid-19",Should i notify the authorities?,I want to learn about which precautions I should take to avoid Corona Virus.,did china create corona virus,is scientist making a cure for the corona virus,was coronavirus intentional,does covid-19 live on food,,,,,,,,,
I wonder what corona virus is,I am wondering what triggered COVID-19?,does covid-19 cause laryngitis,I have had a cough for several days.,Show me emergency contact information for local authorities.,I want to learn how to stay safe from Covid19.,did company create corona virus vaccine,is there a cure for corona virus,was coronavirus made in a lab,does covid-19 live on surfaces,,,,,,,,,
I would like learn more about this Covid19 virus.,I am wondering who was the first person to get the virus,does covid-19 cause nasal congestion,I have had a runny noes for several days.,Show me emergency contact numbers in my area.,I want to learn some measures against corona virus.,did corona virus reach the u.s,Is there a cure for the virus?,was coronavirus man made,Does Covid19 really spread via contact?,,,,,,,,,
I'd like to know what covid-19 is,I heard that the virus started at meat shop in China.  Is this true?,does covid-19 cause sore throat,I have high temperatures,Show me emergency numbers for the corona virus.,I would like help teach others how to keep safe from Corona virus.,did corona virus spread to hong kong,is there a cure to a corona virus,was coronavirus manufactured,Does COVID-19 spread through droplets?,,,,,,,,,
I'm wondering what coronavirus is,I want to get information about the origin of coronavirus,does covid-19 cause weight loss,I have intermittent coughing covid19.,Show me the contact numbers for the relevant authorities,I would like to learn how to keep safe of Covid19?,did coronavirus hit russia,Is there a cure?,was coronavirus released on purpose,Does the corona spread by touch?,,,,,,,,,
I'm wondering what makes COVID-19 fatal?,I want to know how covid-19 started,Does covid-19 only affect the lungs?,I have lost my sense of smell and taste.,Show me the corona virus information number.,"If i keep extremely warm, can i kill the virus that i am already infected with?",did coronavirus peak,Is there a drug I can take to cure Corona?,Was Covid19 created in a lab?,Does the virus spread from surfaces to humans?,,,,,,,,,
Information on corona virus,I want to know the cause of the corona virus.,Does covid-19 only affect the upper respiratory system?,I have nausea,Show me what number should I call.,"If i wear a mask, can i get infected?",did coronavirus peak in us,Is there a flu vaccine for the virus,was covid-19 made in a Chinese lab,Does the virus spread quicker through people in specific categories (i.e. those with pre-existing conditions and/or 60+ years old)?,,,,,,,,,
is corona virus a disease,I want to know what the virus was caused by,does covid-19 start with a cold,I have no appetite,Show me who to contact to report a suspected COVID-19 case.,Information on the precautions about corona,did disney close because of corona virus,Is there a medication that can be used?,was covid-19 man made,Does the virus spread thru air?,,,,,,,,,
is corona virus a pheic,I want to know where corona virus emerged.,does covid-19 start with a runny nose,I have no sense of smell,Tell me the contact information for the local authorities.,Is a mask necessary to avoid contracting COVID-19?,did rolo hanner have the corona virus,Is there a medication that treats the symptoms of coronavirus?,Was the virus caused by someone eating a bat?,Does the virus travel on plastic?,,,,,,,,,
is corona virus a virus,I want to know where the virus came from.,does covid-19 start with a sore throat,I have shortness of breath,Tell me the emergency contact information,Is being in group a risk if no one is ill,did simpsons predict the corona virus,Is there a medicine for the virus yet?,Was the virus created by Trump?,Explain me how infection can be spread,,,,,,,,,
is corona virus actually dangerous,I want to know where was the first outbreak of the corona virus?,Ear pain and covid19.,I have shortness of breath.,Tell me what number to call,is coughing on your arm effective in preventing spread of corona virus,did someone at grand valley actually have the corona virus,Is there a treatment for the symptoms of covid-19?,What are the myths about corona,Have there been any person who claimed that they infected through mosquitoes?,,,,,,,,,
is corona virus aiurborne,i want to learn about how the virus began,Find symptoms of coronavirus,I have some symptoms,Tell me what number to contact in case of presenting symptoms.,Is it better to wear a mask?,did the person that had corona virus in chicago die,Is there a vaccine for corona virus,What are the real effects of corona,How am I to know I got the virus,,,,,,,,,
is corona virus as bad as,I want to learn about the origin of coronavirus.,Hair loss and covid19.,I have stones covid19.,Tell me what to do if I think I have covid-19,Is it necessary to put all my clothes in the dryer to kill the virus?,did the simpsons do the corona virus,Is there a Vaccine for Corona virus?,What home remedies should I try?,How are people getting infected?,,,,,,,,,
Is corona virus dangerous,I want to learn how did coronavirus emerge,How affect corona virus?,I have swelled mouth covid19.,Tell me where should I contact,Is it necessary to wear a mask?,do clorox wipes have corona virus in them,Is there a vaccine for the corona virus?,what is china spending money on to help corona virus,How can a person get the corona virus from someone else?,,,,,,,,,
Is corona virus dangerous?,I want to learn how the virus emerged.,How are the symptoms for corona virus different from the regular flu symptoms?,I have trouble breathing,The Ministry of health by dialing *719#,Is standing in the sun a way to prevent the virus?,do i have to go to school corona virus,Is there a vaccine in place to protect those not yet infected,What is not true about the virus,How can corona be expaded,,,,,,,,,
is corona virus enteric,I want to learn more about the origin of coronavirus,How can I know if I am infected with coronavirus?,I have trouble breathing.,What are the emergency contacts for the corona virus pandemic,Is there any information for protecting your child from the Corona virus?,do kittens shed corona virus as they age,Is there a vaccine to prevent Corona?,What is true and what is not true about the virus?,How can covid-19 be spread,,,,,,,,,
is corona virus icos or helical,I want to learn more about what caused COVID -19,How can I know if someone if someone is infected with coronavirus?,"I have yellowish urine covid19.
I have bad diet covid19.
I have join pains covid19.",what are the emergency contacts of,Is there anything I can do to stop myself from getting sick?,do more men than woman have corona virus,Is there any medication I can use to lessen the effects?,What myths are there about the corona virus?,How can i get infected?,,,,,,,,,
Is corona virus new?,I want to learn where did coronavirus emerge,How can i know that i am infected with the virus if i have not shown any symptoms?,I seem to have lost my sense of smell,What are the emergency number for covd-19 cases?,Is there anything I can take that will help boost my immune system?,do us vaccines make us immune to corona virus,Is there any medication that can help?,What myths are there on covid-19?,How can more people be infected,,,,,,,,,
is coronavirus a disease,I would like to learn about the origins of the Corona virus.,How can I notice if somebody is infected with corona,I think I have temperature,What are the phone number and e-mail information for the local authorities?,Is there anything I can take that will prevent me catching corona virus?,Do you have data about the virus?,Is there any medicine at all that can be taken to prevent the virus?,Where can I check covid-19 facts and myths?,How can the virus be passed on to another person,,,,,,,,,
is coronavirus a flu virus,I'm wondering how did this virus start?,How can I tell if I have symptoms of the corona virus?,I want to learn more about corona virus related fever.,what email address should I use if,Is washing your hands better than hand sanitizer?,Do you have new information about corona virus?,Is there any medicine I should not take for corona virus,Where can I find out whether or not some hoaxes are true?,How can the virus be spread,,,,,,,,,
is coronavirus a pandemic,In what country did the COVID-19 virus originate?,How can the virus be detected,I?m coughing a lot,What email address should I use to get more information about corona virus,Is wearing a mask necessary to avoid catching covid-19?,Do you know how many are infected?,Is there any medicine I should take for corona virus,WHO Covid19 hoaxes.,How can the virus be transmitted,,,,,,,,,
is coronavirus a plague,In which way did corona virus appear?,How can you tell if someone has the Corona virus?,If I  have an elevated temperature is that Corona virus?,What email address to use if I think I have the corona virus?,Is wearing a mask the best way to prevent the virus?,Do you know the current number of infected persons?,is there any other cures for the corona virus,"Who is spreading the virus more, men or women?",How can you get the corona virus,,,,,,,,,
