1. covid_intro ,2. covid_origin,3. symptoms_info,4. symtptoms_have,5. emergency_contact,6. precautions,7. current_numbers,8. medication,9. myths_hoaxes,10. how_spreading,,,,,,,,,
Are corona virus and COVID-19 different?,Are Bats really the original cause of the virus in China?,Am I infected,Can the Corona virus cause fever?,Are there any emergency numbers for the corona virus in my area?,"""Social distancing""  means maintaining a distance of how many feet between myself and other people?",a corona virus mutates 100 x faster than influenza,"Are fruits, vegetables and herbs useful in fighting the coronavirus?",Are Africans immune against covid-19,All outside contacts and physical proximity as can be avoided should be insured to keep avoided.,,,,,,,,,
are coronavirus and covid 19 the same,Can you explain how Covid19 started?,are coronavirus symptoms gradual,"Can the fever I have, cause body aches?",Are there any means of contact for Covid19 patients to reach the authorities?,Are masks effective against covid?,a map of the spread of the corona virus,Are there any existing medications I can take to help with the virus,Are children under a certain age immune to the virus,Are people around my dog at risk for corona virus?,,,,,,,,,
are coronaviruses common,Can you explain how the virus started?,are covid-19 antibody tests available yet,Can you tell me if having difficulties to breath is a symptom?,Are there any other ways besides email or phone to contact the authorities?,Are masks important during the Covid19 virus outbreak?,a star singapore corona virus test,Are there any medicinal teas to help against the current virus,are coronavirus victims getting younger,Ask around how covid-19 can be transmited.,,,,,,,,,
are coronaviruses seasonal,Can you explain how this virus came into existence?,are covid-19 stimulus checks taxable,Can you tell me if my coughing and sneezing are signs of corona virus?,Are there doctor numbers listed?,Are masks the only option for preventing Covid19?,Amount of people infected,Are there any Natural remedies that are effective with the virus,Are young people immune to COVID-19?,Can animals spread covid-19?,,,,,,,,,
can covid-19 mutate,Can you explain to me how the virus started?,Are COVID-19 symptoms similar to that of the flu?,Can you tell me if my difficulty to breathe is linked to corona virus?,Are these the only numbers available in case of an emergency?,Are there any way to stop corona virus,Are all the countries in the world infected with the corona virus?,Are there medicines that make the virus more aggresive?,Can a mosquito spread the Corona virus with its bite?,Can animals spread the covid-19 virus?,,,,,,,,,
Can I have information about corona virus?,Can you tell me how did coronavirus emerge?,are covid-19 tests free,do coronavirus patients die of pneumonia,Can i call my regular physician for corona virus symptoms?,Bandana masks.,are astmatics more at risk for corona virus,"As with all medicines, it treat one cause but damages something else later on.",Can exposure to sunshine kill the virus?,Can asymptomatic people spread the virus?,,,,,,,,,
Can you break down the general information for corona virus?,Can you tell me how te virus emerged?,Are the only symptoms of Covid19 coughing and fever?,Do I have corona virus?,Can i go to any hospital if i have shown symptons?,Can I avoid it?,are corona virus victims people with compromised immune systems,Can hydroxychloroquine help cure those affected,Can herbal medicine help to slow spread of Covid19?,Can children contract the virus?,,,,,,,,,
Can you give me information about Covid-19?,Can you tell me how this virus started and when?,Are the symptoms of corona virus like the flu,Do you know if dry cough is a symptom of corona virus?,can I post a mail in case of corona virus emergency,Can I leave the house every day?,are coronavirus cases declining,Can I take a painkiller for a headache?,Can i breathe in extra hot air to kill the virus?,Can children spread the virus?,,,,,,,,,
Can you tell me about Covid-19?,Can you tell me how this virus started?,Are the symptoms the same for all the patients?,Do you know if fevers are symptoms of Covid-19?,Can I send a letter to the local authorities? What is the address?,Can the virus spread be stopped?,are coronavirus cases declining in china,Can I take any medications?,Can i get a tuberculosis shot to be immune to the virus?,can corona virus be spread by bats,,,,,,,,,
Can you tell me about the corona virus?,Can you tell me the origin of covid?,Arthritis and covid19.,Do you think I have the Corona virus because I have a cough?,Can I send an email detailing my symptoms?,Can we stop the spread of Covid19 and how?,are coronavirus cases decreasing,Can I take aspirin if I have corona virus,Can my dog get coronavirus?,can coronavirus be spread by mail,,,,,,,,,
Can you tell me more about COVID-19?,Can you tell me where the Corona virus started?,can coronavirus cause a rash,Does anyone who has a fever mean that they have the virus?,Can you confirm the numbers and email for our authorities should I need them?,Can wearing a mask help prevent the spread of the corona virus?,are coronavirus cases decreasing in china,Can I take this medicine?,Can my pet get corona virus,can coronavirus be transmitted through food,,,,,,,,,
Can you tell me more this new virus Covid19?,Coronavirus in wuhan,can coronavirus cause diarrhea,have coronavirus without symptoms,Can you give me the number for the local health authorities?,Can you prevent getting corona virus?,are coronavirus cases dropping,Can I use antibiotics to help fight the virus,Can my pet get coronavirus?,can coronavirus live in water,,,,,,,,,
Can you tell me what corona virus is,Coronavirus origins and SARS and MERS,Can you enumerate covid's symptoms?,Having a difficulty to breathe could mean one is infected,Can you give me the phone number?,Can you prevent getting COVID-19?,are coronavirus cases dropping in china,Can I use Ibuprofen for corona virus?,Can the transmission be done by mosquitos?,can coronavirus live on cardboard,,,,,,,,,
Can you tell me what Corona virus is?,Could you tell me where COVID-19 first emerged?,Can you explain all the symptoms of Covid19?,How can I tell if I have covid-19 symptoms?,Can you provide me with the emergency numbers?,Can you tell me how can I avoid getting the virus,are coronavirus cases dropping in georgia,Can I use over the counter drugs to stave off the virus?,Can you get the same corona virus more than one time,can coronavirus live on clothes,,,,,,,,,
Can you tell me what coronavirus is?,Covid19 and china.,Can you list the symptoms of the corona virus?,How can I tell if my symptoms are due to the corona virus or allergies?,Can you show me the number to medical emergencies,Can you tell me how to prevent getting Corona virus?,are coronavirus cases dropping in the us,Can I use paracetamol for the corona virus?,Can you tell me any myths about the Corona Virus?,can coronavirus live on clothing,,,,,,,,,
Can you tell me what covid-19 is?,Covid19 corona virus in bats.,Can you tell me if fever is considered a symptom of the virus?,How does a fever relate with the virus?,Can you tell me the phone number?,Can you tell me how to protect myself against COVID -19?,are coronavirus cases going down,Can I use Tylenol to treat the fever?,Can young people get COVID-19?,can coronavirus live on fabric,,,,,,,,,
Can you tell me where the corona virus attacks?,Covid19 coronavirus live markets.,Can you tell me if the symptoms of COVID-19 appear in a specific order?,How does fever affect Corona virus patients?,Can you tell me which number to call about the virus?,Can you tell me some tips for coronavirus prevention?,are coronavirus cases leveling off,can paracetamol be used to cure corona virus,Corona and hot lime water.,can coronavirus live on food,,,,,,,,,
Cornavirus pandemic.,Did Corona virus really start from bats?,Can you tell me some of the symptoms of the Virus?,I ache all over,Can you tell which number should I dial?,Can you tell me the best measure to take in order to avoid contracting the virus.,are coronavirus cases slowing down,Can paracetamol help treat the corona virus?,Covid 19 separating myths from facts.,can coronavirus live on hair,,,,,,,,,
Corona virus at a glance,did coronavirus come from a bat,Can you tell me the symptoms of coronavirus?,I am always tired.,contacts of corona virus hospital in,Cloth masks.,are coronavirus deaths accurate,Can someone take Ibuprofen for the virus?,Covid19 and frequency of testing if there is common cold and flu.,can coronavirus live on mail,,,,,,,,,
Corona virus covid 19 latest updates.,did coronavirus come from a lab,Can you tell me the symptoms?,I am cold sweating.,Cornavirus rapid response.,Conavirus reusable home made masks.,are coronavirus deaths underreported,Can you give me information about the recommended medication?,Covid19 and its allergic effects post 2 months of self quarantine.,can coronavirus live on money,,,,,,,,,
Coronavirus and SARS and MERS.,did coronavirus come from an animal,Can you tell what the symptoms of covid-19 are?,I am coughing a lot.,Corona ambulance.,Corona alcohol based sanitizer.,are coronavirus infections slowing down,Can you show me a list of medications that can defeat the corona virus?,Covid19 and its facts.,can coronavirus live on newspaper,,,,,,,,,
Coronavirus covid19 effect on global economy.,did coronavirus come from animals,Chills and covid19.,I am experiencing fever and chills,Coronavirus  state number.,Corona and its precautions.,are coronavirus models accurate,Can you show me which medicines are best against corona?,Covid19 and its self help via self quarantine immune booster.,can coronavirus live on objects,,,,,,,,,
Coronavirus sars and mers,did coronavirus come from bat soup,Conditions of a person infected with corona virus,I am experiencing high body temperatures.,Coronavirus 911.,Corona and its sanitiser.,are coronavirus numbers accurate,Can you tell me how can I treat covid?,Covid19 and its treatments with alcohol.,can coronavirus live on packages,,,,,,,,,
Could you please tell me something about corona virus,did coronavirus come from bats,Cornavirus breathing.,I am experiencing shortness of breath.,Coronavirus Counselling.,Corona immune masks.,are coronavirus numbers going down,can you tell me if hydroxychloroquine heals covid-19,Covid19 and the doomsday.,can coronavirus live on paper,,,,,,,,,
Could you show me information regarding coronavirus?,did coronavirus come from chickens,Corona and its damage.,"I am feeling sick, lost my sense of taste and smell.",Coronavirus district control number.,Corona purell .,are covid-19 cases dropping in us,Corona allopathy versus homeopathy.,Covid19 and the misinformation industry.,can coronavirus spread from mail or packages,,,,,,,,,
Could you tell me more about COVID-19?,did coronavirus come from china,Corona and its damages.,I am feverish,Coronavirus district health center.,Corona sanitiser.,are covid-19 deaths accurate,"Corona and breathlessness.
Corona asthma inhaler.
Corona lungs swelling.",Covid19 cough syrups and inhalers.,can coronavirus spread through air,,,,,,,,,
Define corona virus for me?,did coronavirus come from eating bats,Corona effects on eyesight.,"I am finding it hard to breathe, is it Corona virus?",Coronavirus district help center.,Corona simple masks.,Are people still dying from the virus?,"Corona and general hygiene.
Corona and its medication.
Corona and home quarantine.",Covid19 hoaxes.,can coronavirus spread through food,,,,,,,,,
Definition of corona virus,did coronavirus come from pangolins,Corona symptoms.,I am getting chills.,Coronavirus district repository center.,Corona soft masks.,are sars and mers caused by a corona virus,Corona and hydroxychloroquine effects.,Covid19 home remedies and hot fluids.,can coronavirus spread through water,,,,,,,,,
Describe the coronavirus.,did coronavirus come from snakes,Coronavirus and asthma.,I am having some temperature,Coronavirus district wise nemergency helpline.,Coronavirus hand sanitizer.,are some people immune to corona virus,Corona and hydroxychloroquinine.,Covid19 myths and lies.,can coronavirus survive freezing,,,,,,,,,
did coronavirus mutate,did coronavirus come from wuhan lab,Coronavirus and breathing allergy.,I am having trouble breathing,Coronavirus elderly response.,Covid 19 hand sanitiser and cleaning frequency.,are the markets safe with the corona virus,Corona and immune mobilising tablets.,Did china find a cure for the virus and doesnt want to share with the world?,can coronavirus survive in hot weather,,,,,,,,,
do coronavirus mutate,did coronavirus start from a bat,"Coronavirus and breathing.
",I am having trouble breathing.,Coronavirus Emergency,Do i have to wash my hands all the time?,Are there any new updates on corona virus?,Corona and isburofan.,did coronavirus begin in a lab,can coronavirus survive in warm weather,,,,,,,,,
Do you have facts about COVID-19?,did coronavirus start from bats,Coronavirus and Cough.,I am not feeling well,Coronavirus emergency contact number.,Do i have to wear a face mask?,Are there any updates on Covid-19?,Corona and its immediate remedies.,did coronavirus come from a lab,can coronavirus survive in water,,,,,,,,,
Do you have information about Covid-19?,did coronavirus start from eating bats,Coronavirus and eye burning.,I am sneezing a lot.,Coronavirus Emergency contact numbers.,Do I need to wear gloves,are there cases of of the corona virus in london,Corona and its remedies.,did coronavirus start in a lab,can coronavirus survive on paper,,,,,,,,,
Do you have information on covid-19?,did coronavirus start in china,Coronavirus and headache.,I am suffering from a fever,Coronavirus emergency numbers.,Do you know any corona virus preventive measures and remedies?,Are there many people infected?,Corona and purell.,Did Covid 19 come about as a result of 5G Technology?,can covid-19 be spread by mosquitoes,,,,,,,,,
Do you have information that you would like to share about what the Corona virus is?,did coronavirus start in the us,Coronavirus and its allergies.,I am sweating but feeling cold and have chills,"Coronavirus emergency testing center,",Do you know how I can protect myself against coronavirus?,are there more people dying from corona virus or flu,Corona and turmeric.,Do 5G mobile networks spread COVID-19?,Can COVID-19 be spread through food contamination?,,,,,,,,,
Do you know about Covid-19?,did coronavirus start with bats,Coronavirus and its effects.,I am wondering do I have Corona if my body hurts?,Coronavirus Government helpline.,Do you know how long  should I stay at home?,are white people immune to corona virus,Corona and usage of paracetamol.,do black people get corona virus,Can covid-19 be spread through the air?,,,,,,,,,
Do you know if the corona virus a flu strain?,Did Covid originate from China?,"Coronavirus and its symptoms.",I am wondering if a toothache is a symptom of coronavirus.,Coronavirus ICMR.,does a mask prevent covid 19,are women getting corona virus,Corona home remedies.,do chemtrails spread covid 19,can covid-19 live in the freezer,,,,,,,,,
Do you know what Corona virus is?,Did COVID-19 come from a particular country?,"Coronavirus and Lungs infection.",I am wondering if I have the corona virus.,Coronavirus information contact numbers.,Does drinking lots of water help?,As of today how many people have Corona virus?,Corona naturopathy.,Do marijuana smokers get the virus worse than non marijuana smokers?,can covid-19 live in water,,,,,,,,,
Do you know what coronavirus is?,Did covid-19 come from China?,"Coronavirus and neckpain.",I am wondering if my high fever could be a sign of corona virus.,Coronavirus medical support.,Does extreme warmth kill the virus?,At what rate is the corona virus spreading?,Corona plant based remedies.,Does drinking vitamin C prevent the corona,can covid-19 live on food,,,,,,,,,
Do you know what covid-19 is?,Did covid-19 come from people eating bats?,Coronavirus and respiratory disease.,I cannot stand for long before feeling to faint.,Coronavirus NHS.,Does washing my clothes help preventing the virus?,Break down the statistics concerning COVID-19 by geographical region.,Coronavirus and btg medicine.,Does drinking water flush out corona virus,can covid-19 live on paper,,,,,,,,,
"Do you know what Covid19 is?",did covid-19 originated in europe,Coronavirus and viral fever.,I cannot taste anything,Coronavirus outreach.,Does wearing a mask help prevent the virus,can a 12 year old die from corona virus,Coronavirus hydroxychloroquine,does limon help to cure corona virus,can covid-19 live on surfaces,,,,,,,,,
Do you know what is corona virus?,Did Covid19 really start in December 2019?,Coronavirus initial attacks.,I can't breathe.,Coronavirus private hospitals.,does wearing a mask protect from getting corona virus,can a gas mask protect your from corona virus,Coronavirus medicine.,Does race/ethnicity play a factor in the spread of the virus,can covid-19 survive in the freezer,,,,,,,,,
Explain corona virus.,did covid-19 start in europe,Coronavirus symptoms,I can't get out of bed.,Coronavirus sampling contact.,Explain how corona virus can be prevented,can african americans get the corona virus,Coronavirus medicines.,Does snake oil cure covid?,Can dogs spread coronavirus?,,,,,,,,,
Explain coronavirus.,Did the Chinese invent corona virus?,coronavirus whose most at risk,I can't smell anything,Coronavirus state emergency number.,Explain to me ways that I can prevent catching the Corona virus?,can african blood get corona virus,Coronavirus treatment.,Does the sun kill Corona virus?,Can I get Corona virus by swimming in the sea?,,,,,,,,,
Explain Covid please?,Did the corona virus come from animals?,Could you please tell me what the symptoms of covid are?,I can't smell things,Coronavirus state health emergency.,Fibre masks.,can an adult dog get corona virus,Could you search for me if I should take paracetamol?,Does the virus spread more in cold countries or hot countries?,Can I get corona virus from my pet,,,,,,,,,
Explain me what corona virus is,Did the virus come from an animal?,Covid 19 reactivation symptoms.,I can't stop coughing,Coronavirus state medical response team.,Give me advice to prevent getting sick,can an animal give a person corona virus,Could you tell me whether I can take this medcine?,Does the virus survive extreme heat?,Can I get coronavirus by kissing someone?,,,,,,,,,
Explain the Corona Virus,Do we know how this virus came to be?,Covid19 and its allergies WHO.,I can't taste anything,Coronavirus statewise numbers.,Home made masks.,can birds catch corona virus,Covid 19 and self medication are equally good to administer even with low symptoms.,Has Cuba found a cure for the corona virus already?,Can I get covid from my dog?,,,,,,,,,
Give me an overview of COVID-19.,Do you have information about the cause of the virus?,Covid19 and skin itching and red rashes and red eyes.,I cough up phlegm.,Could you please send me a phone number to contact the authorities?,How can i avoid getting infected?,can black people be affected by the corona virus,Covid19 and its drug dosage.,Has France found a cure for the corona virus already?,Can I get it from my pet?,,,,,,,,,
Give me information about corona virus,Do you know how Covid-19 began?,Covid19 causes the respiratory blockages in its acute stages and known to impair the normal breathing processes .,I don't feel any taste in the food,Covid district health hospitals.,How can I be precautionary about corona,can cats get corona virus,Covid19 and usage of hydoxychloroquinine is a step to immediately conquer the disease.,Has Germany found a cure for the corona virus already?,Can I get the corona virus from my mail?,,,,,,,,,
Give me information about corona virus.,Do you know how covid-19 started?,Covid19 checkups and symptoms.,I feel dizzy.,Do I call 311?,How can I fight coronavirus?,can corona virus be carried from parts,Covid19 intake of paracetamol is not sufficient.,Has there been any research on mosquitoes linked to Covid19?,Can I get the virus from speaking to someone 6 feet away from me?,,,,,,,,,
Give me information about Coronavirus,Do you know how the corona virus began?,Describe coronavirus traits,"I feel fine, except I have a slight cough. Does that mean I have symptoms of covid-19?",Do I call 911?,How can I keep my grandparents from getting Corona virus?,can corona virus be spread from objects shipped from china,"Covid19 treatment",How can I distinguish between rumor and facts about corona virus?,Can I get the virus from touching something an infected person touched?,,,,,,,,,
Give me more information on coronavirus.,Do you know how the virus emerged?,Describe to me the symptoms of the coronavirus.,I feel ill.,Do they have contact numbers?,How can I keep myself safe,can corona virus be spreaded by people,do any antivirals work against covid 19,How can I get trust-worthy information?,Can I spread the virus by touching someone?,,,,,,,,,
has coronavirus mutated,Do you know how this virus started?,Detail me the symptoms of coronavirus.,I feel like I'm about to throw up,Do you have the contacts?,How can i make sure that i am safe from the virus?,can corona virus cause seizures,do coronavirus have cure,How does eating dead animals give me the virus?,Can kissing lead to spread,,,,,,,,,
How can corona virus be explained,Do you know the origin of COVID-19?,Do a search for the symptoms of Corona virus,I feel more tired than usual.,Do you know how should I reach out to the authorities?,How can I prevent corona virus,can corona virus change cat poop,do covid-19 antibodies confer immunity,I am wondering if eating garlic can help to prevent COVID-19.,Can my pet transmit the corona virus?,,,,,,,,,
How can I find out more about covid-19?,Do you know when Corona virus started?,Do all Covid19 patients have fever and cough?,I feel my throat soared,Do you know the contact details for corona virus emergency situations?,How can I prevent from catching the virus?,can corona virus give a false positive parvo test result,do covid-19 antibodies prevent reinfection,I heard if you gurgle with water and salt you will avoid catching the virus. Is this true?,Can one person infect a whole group of people with COVID-19?,,,,,,,,,
How can i understand the general information on corona virus?,Do you know where Corona virus started first?,do coronavirus patients cough up blood,I feel really tired,Do you know which number to call?,How can I prevent the virus?,can corona virus make another virus,do covid-19 antibodies provide immunity,I want to know what is false about the virus,Can rats transmit the corona virus,,,,,,,,,
How can i understand what corona virus is?,Do you know where the corona virus began?,do coronavirus symptoms come and go,I feel sick,Do you know who should I contact?,How can I protect myself against COVID-19?,can corona virus spread through packages,Do the malaria tablets kill the virus?,I want to learn about the myths regarding the origin and spread of covid-19.,Can the Corona virus be spread through mosquitoes?,,,,,,,,,
how coronavirus works,Do you know where the COVID-19 virus came from?,do coronavirus symptoms come on fast,I feel sick.,How can I get help if I have symptoms?,How can I protect myself?,can corona virus travel through vents,Do Vitamins actually help fight the corona virus,I want to learn more about disinformation about covid-19,Can the virus be spread by farts?,,,,,,,,,
How dangerous is corona virus?,does coronavirus come from bats,do coronavirus symptoms come on quickly,I feel tired,How can I get in touch with the authorities,How can I stay safe during corona virus emergency,can dogs get corona virus,Do we have treatment for the virus?,I want to learn more about wide spread myths as regards covi.,Can the virus be spread from a pregnant woman to her child?,,,,,,,,,
How to define the Corona Virus,Explain how the Corona virus started,do coronavirus symptoms come on slowly,I feel tired and weak,How can I get more information about the corona virus disease?,How can I stop spread of Covid19?,Can I know the number of people who have the virus?,Do you believe that untested medicine should be given to patients?,I would like to see research done for mosquitoes and the Corona virus.,Can the virus be spread from air conditioning ventilators?,,,,,,,,,
I am curious about corona virus,Explain how the virus came up,do coronavirus symptoms come on suddenly,I feel weak,How can I let the authorities know I suspect I have the corona virus?,How can we stop the infection of this virus?,can probiotics cause corona virus to mutate to fip,Do you know if you can take anti-depressants while having Covid-19.,"If there is no cure, how come people are being sent home",Can the virus be spread from humans to animals?,,,,,,,,,
I am curious about the corona virus.,Explain the cause giving origin to the virus,do coronavirus symptoms linger,I had a fever but it went away. Now I have a cough. Do I have symptoms of covid-19?,How can I reach the local authorities?,How can we work together to stop the spread of Covid19?,can the corona virus affect teens,Do you know what kind of medication I can take for Covid19?,Is China using covid-19 to take over the world?,Can the virus be spread through handshakes,,,,,,,,,
I am curious about the new virus,How can i know where this virus first came from?,do coronavirus symptoms wax and wane,I have a bad cough,How do I contact the authorities,How do I avoid contracting it?,can the corona virus be transmitted from birds,Does antibiotics help with the corona virus?,Is Corona a disease that was improvised in the labs?,Can the virus be spread through semen?,,,,,,,,,
