what coronavirus looks like,when is the corona virus started,Is a headache a symptom of coronavirus?,,,What safety gear do I wear to stop the virus?,Have more people died or recovered?,,,Please tell me how COVID-19 is spreading?,,,,,,,,,
what covid-19 stands for,when was first corona virus case,Is a sore throat a symptom of the corona virus?,,,What should be done at home to prevent infection with corona,have states banned routes to kerala corona virus,,,Search 'coronavirus spread' for me,,,,,,,,,
what disease is corona virus,when was the chinese corona virus first spotted,Is a two week cough a sign of Coronavirus?,,,What should I do to avoid catching corona,Have there been any updates on this Covid19 virus recently?,,,Search for me if COVID-19 can be spread via surfaces.,,,,,,,,,
What do I need to know about corona virus,Where can I find information on the origins of covid-19?,Is breathing difficulty a signature symptom of the corona virus?,,,What should I do to not get the virus,how accurate is the data fron china on corona virus,,,Search 'how does coronavirus spread' for me,,,,,,,,,
what do i need to know about coronavirus,Where can I find the truth about the origins of the corona virus?,is corona virus harmful,,,what to do if someone got the corona virus,how amn popel have did corona virus,,,Should I be concerned that mosquitoes spread Corona virus?,,,,,,,,,
What do I need to know about the Corona virus,Where can we trace the origins of covid-19?,is corona virus worse than the common flu,,,What's the best precaution for the virus?,how amny americans have been infected with the corona virus,,,Should I worry about mosquitos spreading it?,,,,,,,,,
What do I need to know about the Novel Coronavirus disease?,where corona virus started,Is coronavirus symptoms like the flu?,,,where to buy surgical masks against corona virus,how are cats exposed to corona virus,,,Should we take precautions for mosquito bites during the Covid19 outbreak?,,,,,,,,,
What do we know about Covid-19?,where coronavirus came from in china,is coughing a symptom of corona virus,,,Which are the measures to take against the virus,how are corona virus cruise ship quarrantine people getting food,,,Show me how COVID-19 is transmitted?,,,,,,,,,
What do you know about corona virus?,where coronavirus come from,Is diarrhea a symptom of coronavirus?,,,Which are the precautionary measures?,how are the corona virus and the 10 plagues similar,,,Show me how does coronavirus spread in a population,,,,,,,,,
What do you know about coronavirus,where coronavirus come from 2020,Is fatigue a symptom of the corona virus?,,,which coronavirus masks work,how can corona virus be connected to the past,,,Show me how is the virus spreading,,,,,,,,,
What do you know of this Corona virus?,where coronavirus get its name,Is fever a corona virus symptom?,,,which mask can prevent the infection of corona virus,how can corona virus be detected,,,Show me how the virus is spreading around the world.,,,,,,,,,
what does corona virus mean,where coronavirus has been found,Is fever a symptom of the virus,,,which mask is better against corona virus,how can corona virus kill you,,,Show me ways people get covid 19,,,,,,,,,
What does COVID-19 stand for?,where coronavirus originated,Is fever a symptom?,,,which masks corona virus,How can I check how many people are infected in my country,,,Tell me how the virus spreads,,,,,,,,,
What entails corona virus,where coronavirus started,Is fever normal in covid-19?,,,why wear a mask corona virus,how can we solve the corona virus,,,Tell me more about how the virus can spread from surfaces to humans.,,,,,,,,,
What is a pandemic?,where coronavirus started in china,Is headache a symptom of coronavirus?,,,will 2 ply face mask help with corona virus,how can you avoid getting the corona virus,,,The prime causage of it is known to be a physical contact with the virus infected patient.,,,,,,,,,
What is corona virus defined by,where coronavirus started in wuhan,Is high fever a symptom of covid-19?,,,will n-95 masks protect agains corona virus,how can you get rid of the corona virus contagious,,,There have been no reports on mosquitoes spreading the Corona virus.,,,,,,,,,
What is corona virus?,where covid-19 really come from,Is runny nose a corona virus symptom?,,,Will social distancing really help prevent catching the virus?,how common are severe cases of the corona virus,,,Was it ruled out that mosquitoes cannot spread the virus?,,,,,,,,,
What is coronavirus?,Where did corona virus come from,Is runny nose a COVID-19 symptom?,,,,how common i sthe corona virus in cats,,,What are the modes of transmission for COVID-19?,,,,,,,,,
what is covid 19,Where did corona virus come from?,Is shortness of breath a common symptom of the corona virus?,,,,how corona virus changes in a month,,,What are the most common means of transmission of the virus,,,,,,,,,
What is COVID-19,where did corona virus originate patient 0,Is shortness of breath a sign of corona virus,,,,how corona virus started,,,What are ways in which the Corona virus is spreading?,,,,,,,,,
What is COVID-19 about?,Where did coronavirus come from?,Is shortness of breath a sign of Corona?,,,,how could we stop the corona virus,,,What are ways that the virus can be spread?,,,,,,,,,
What is COVID-19?,Where did coronavirus emerge?,Is sore throat a symptom of coronavirus?,,,,how dangerous is corona virus,,,What can cause the virus,,,,,,,,,
What is SARS-CoV-2?,Where did Covid originate from?,Is the corona virus symptoms like the flu?,,,,how deadlt is the corona virus,,,What do we understand by the spread of the Corona virus?,,,,,,,,,
What is the corona virus?,Where did COVID-19 come from?,Is the loss of sense of smell a tell-tale sign of having COVID-19?,,,,how did japan deal with the corona virus,,,What happens when corona virus spreads,,,,,,,,,
What is the Covid-19 strain virus,Where did COVID-19 originate from?,Leg pain and covid19.,,,,how did the corona virus originate,,,What is the cause for the virus spreading,,,,,,,,,
What is the COVID-19 virus?,Where did covid-19 originate?,Look up corona virus symptoms,,,,how did the wuhan corona virus start,,,What is the safe distance from someone with flu like symptoms,,,,,,,,,
What is the definition of Corona Virus or Covid-19?,Where did the Corona virus come from?,Look up COVID-19 symptoms,,,,how do doctors know if you have corona virus,,,What measure are in place for containing the spread of Covid19?,,,,,,,,,
what is the difference between COVID 19 and corona virus,Where did the Corona Virus first appear,Look up 'shortness of breath' and 'corona virus',,,,How do I compare infection rates of different countries,,,what states has the corona virus spread to,,,,,,,,,
What is the general definition of Corona virus or covid-19?,where did the corona virus originate in china,Look up 'shortness of breath' and 'COVID-19.',,,,how do people think the corona virus began,,,where are the locations of corona virus in the us,,,,,,,,,
what is the r/o for covid 19,Where did the Corona virus pop up?,Neck pain and covid19.,,,,how do people with corona virus look,,,where are the us cases of corona virus,,,,,,,,,
what is the r0 for covid 19,Where did the Corona virus start affecting people first?,Pale skin and covid 19.,,,,how do some researchers believe that the corona virus began,,,Where can I get information on the spread of Covid19?,,,,,,,,,
What is this new Corona virus and can you tell me more?,Where did the COVID-19 virus originate?,please define the symptoms of the covid-19 virus,,,,how do some researchers believe the corona virus was syatyed,,,Where can I learn about how the corona virus spreads?,,,,,,,,,
What is this new pandemic virus going around?,Where did the first corona virus patients first get diagnosed?,Please explain the symptoms of the corona virus to me?,,,,how do you detect the corona virus,,,Where does corona virus spread the most,,,,,,,,,
What is this virus?,Where did the virus come from?,Please tell me if pets have symptoms.,,,,how do you diagnose corona virus in dogs,,,where has the corona virus spread so far,,,,,,,,,
what kind of disease is corona virus,Where did the virus originate,Red eyes and covid19.,,,,how do you die when you get the corona virus,,,where in the world is the corona virus,,,,,,,,,
What kind of disease is Corona virus?,Where did the virus originate from,Search for coronavirus symptoms.,,,,how does corona virus being spread,,,where is corona virus in indonesia,,,,,,,,,
what makes a corona virus a coronavirus,Where does the virus come from,Search for me the symptoms of the Covid-19.,,,,how does the corona virus spread from human to human,,,where is the corona virus spreading america,,,,,,,,,
What should I know about the Coronavirus?,Where does the virus come from?,Search for me what the symptoms are.,,,,how easy is it to spot corona virus,,,Who are most likely to get the corona virus?,,,,,,,,,
What should people know about coronavirus?,where in asia did they find the corona virus,Show me all symptoms of covid-19.,,,,how effective is gilead drug for corona virus,,,Who can transmit corona virus?,,,,,,,,,
What virus is causing the global pandemic?,where is the origin of corona virus,Show me corona virus symptoms,,,,how face vaccine corona virus,,,Why does the Corona virus spread so easily?,,,,,,,,,
what's the corona virus,where is the origin of corona virus in china,Show me symptoms of COVID-19,,,,how far are we to developing a corona virus vaccine,,,why I have to stay at home,,,,,,,,,
where did the name corona virus come from,Where is the place of origin of the virus?,Show me the symptoms for COVID-19.,,,,how fast can test corona virus and how,,,Why is the virus being spread more and more?,,,,,,,,,
why coronavirus is deadly,Where is the virus coming from?,Show me the symptoms of coronavirus,,,,how fast does the corona virus spread,,,Will there be anymore infections?,,,,,,,,,
why coronavirus kills,Where is the virus originally from?,Show me the symptoms to look out for the for the corona virus,,,,How has corona affected rural population.,,,would microwave kill coronavirus,,,,,,,,,
why covid-19 is considered a pandemic,Where started corona virus?,Show me what to expect with COVID-19 infection,,,,how has corona virus affected cruise industry,,,Would you tell me if mosquitos can spread covid-19?,,,,,,,,,
why does corona virus kill you,where the corona virus started,Signs of corona virus,,,,how is china handling the corona virus,,,Would you tell the way in which covid-19 is spread?,,,,,,,,,
why is corona called corona virus,Where was the first case of corona virus?,Somniac and covid19.,,,,how is china in stage 5 with the corona virus,,,,,,,,,,,,
why is coronavirus called corona virus,Which city had the first case of the Corona virus?,Sweating and covid19.,,,,how is china into stage 5 with the corona virus,,,,,,,,,,,,
why is it called to corona virus,Which country first had corona virus,Symptoms that you may have covid-19,,,,how is china trying to stop the corona virus,,,,,,,,,,,,
Wondering about the corona Virus?,Who started the corona virus?,Tell me about the symptoms of COVID-19,,,,how is corona virus affecting euro disney,,,,,,,,,,,,
Would you tell me about COVID-19?,Who was the first to get the corona virus,Tell me about the symptoms of COVID-19.,,,,how is corona virus spread on a plane,,,,,,,,,,,,
,Who were the first people to show signs of Covid19?,Tell me more about covid-19 symptoms.,,,,how is corona virus test conducted,,,,,,,,,,,,
,,Tell me more about the symptoms of corona virus.,,,,how is the corona virus affecting china,,,,,,,,,,,,
,,Tell me the early signs of the corona virus?,,,,how is the corona virus curred,,,,,,,,,,,,
,,tell me the symptoms of the corona virus,,,,how it corona virus spread,,,,,,,,,,,,
,,Throat infection and covid19.,,,,how likely are you to catch corona virus in korea,,,,,,,,,,,,
,,What are all the symptoms of Coronavirus?,,,,how likely are you to die from corona virus,,,,,,,,,,,,
,,What are all the symptoms of the corona virus?,,,,how long are you sick corona virus,,,,,,,,,,,,
,,What are corona virus symptoms?,,,,how long can the corona virus stay on surfaces,,,,,,,,,,,,
,,What are COVID-19 symptoms?,,,,how long can the corona virus survive on surfaces,,,,,,,,,,,,
,,What are signs of corona virus,,,,how long corona virus can live,,,,,,,,,,,,
,,What are some signs of having the corona virus?,,,,how long corona virus live outside host,,,,,,,,,,,,
,,what are symtpoms of the corona virus,,,,how long does corona virus last on the surface,,,,,,,,,,,,
,,what are the affects in the corona virus,,,,how long does corona virus live outside of host,,,,,,,,,,,,
,,What are the common symptoms of corona?,,,,how long does corona virus take to kill someone,,,,,,,,,,,,
,,What are the first symptoms of corona?,,,,how long does someone live with the corona virus,,,,,,,,,,,,
,,What are the hints to know if someone is infected with corona,,,,how long is the corona virus suppose t0o last,,,,,,,,,,,,
,,What are the main symptoms of the corona virus?,,,,how long sould we expect corona virus to last,,,,,,,,,,,,
,,What are the mains symptoms of coronavirus?,,,,how long the corona virus infection last,,,,,,,,,,,,
,,What are the most common symptoms of the corona virus?,,,,how manny have died from corona virus,,,,,,,,,,,,
,,What are the signs of a person infected with the virus?,,,,How many active cases of covid-19 are there?,,,,,,,,,,,,
,,what are the signs of someone having the corona virus,,,,how many affected corona virus in india,,,,,,,,,,,,
,,What are the signs of the virus,,,,how many americans are infected with the corona virus,,,,,,,,,,,,
,,What are the specifications of the virus,,,,how many americans have the corona virus,,,,,,,,,,,,
,,What are the symptoms for covid-19?,,,,How many cases are in this city?,,,,,,,,,,,,
,,What are the symptoms for the corona virus?,,,,how many cases in america are there of corona virus,,,,,,,,,,,,
,,What are the symptoms of coronavirus like?,,,,How many cases in my country? ,,,,,,,,,,,,
,,What are the symptoms of coronavirus?,,,,How many cases of corona virus are,,,,,,,,,,,,
,,What are the symptoms of COVID-19?,,,,how many cases of corona virus in the us today,,,,,,,,,,,,
,,What are the symptoms of the corona virus?,,,,How many cases of infection are there?,,,,,,,,,,,,
,,What are the symptoms of the Covid19 virus and how long before they show up?,,,,how many cases of the corona virus are in california,,,,,,,,,,,,
,,what are two other symptoms of corona virus,,,,how many child killed in corona virus,,,,,,,,,,,,
,,what corona virus causes low white blood cell count,,,,how many children have died of corona virus,,,,,,,,,,,,
,,what coronavirus does,,,,how many confirmed cases of corona virus is in missouri,,,,,,,,,,,,
,,what coronavirus does to lungs,,,,how many corona virus cases globaly,,,,,,,,,,,,
,,what coronavirus does to the body,,,,how many corona virus in japan,,,,,,,,,,,,
,,what coronavirus does to your lungs,,,,How many countries has the virus spread to?,,,,,,,,,,,,
,,what coronavirus feels like,,,,how many covid 19 cases are reported in the usa,,,,,,,,,,,,
,,what coronavirus symptoms,,,,how many dead from corona virus,,,,,,,,,,,,
,,what coronavirus symptoms come first,,,,how many deaths from corona virus,,,,,,,,,,,,
,,what coronavirus symptoms in humans,,,,how many deaths from corona virus in usa,,,,,,,,,,,,
,,what covid-19 antibody tests are available,,,,how many deaths from the corona virus,,,,,,,,,,,,
,,what covid-19 does to the brain,,,,how many deaths have happened from corona virus,,,,,,,,,,,,
,,what covid-19 does to your brain,,,,how many deaths per year from corona virus,,,,,,,,,,,,
,,what covid-19 is and how it affects the respiratory system,,,,How many deaths related to COVID-19 have occurred?,,,,,,,,,,,,
,,What do I need to look for in a person suspected with the virus,,,,how many deaths were causaed by the corona virus,,,,,,,,,,,,
,,What do i need to look out for in terms of the symptoms of the corona virus,,,,how many have been healed from corona virus,,,,,,,,,,,,
,,what does a corona virus infections,,,,how many infected by corona virus until now,,,,,,,,,,,,
,,What does corona virus do?,,,,How many infected people are,,,,,,,,,,,,
,,what does new corona virus do,,,,How many infected people are in my region?,,,,,,,,,,,,
,,what does the corona virus,,,,How many infected people are in our country?,,,,,,,,,,,,
,,what is dangerous about corona virus,,,,how many ople in thailand have the corona virus,,,,,,,,,,,,
,,what is the diagnostic test for corona virus,,,,how many peaople have died from the corona virus,,,,,,,,,,,,
,,What is the difference between corona virus symptoms and the common cold,,,,how many peole have the corona virus,,,,,,,,,,,,
,,What kind of cough is associated with corona virus?,,,,how many peop have the corona virus,,,,,,,,,,,,
,,What kind of cough is associated with COVID-19?,,,,how many people ahave died from the corona virus,,,,,,,,,,,,
,,What signs to look out for to know if I have been infected with the corona virus?,,,,how many people ahve the corona virus in usa,,,,,,,,,,,,
,,What symptoms are associated with corona virus?,,,,how many people are affected by the corona virus,,,,,,,,,,,,
,,What symptoms come from corona virus,,,,how many people are currenlty infected by the corona virus,,,,,,,,,,,,
,,What symptoms differ from the corona virus to other viruses,,,,How many people are hospitalized?,,,,,,,,,,,,
,,What symptoms does coronavirus have?,,,,how many people are in china with the corona virus,,,,,,,,,,,,
,,What type of symptoms does Covid19 have? ,,,,How many people are infected in my city?,,,,,,,,,,,,
,,What will I experience if I have the corona virus?,,,,How many people are infected in my country?,,,,,,,,,,,,
,,when coronavirus stimulus,,,,How many people are infected with covid-19?,,,,,,,,,,,,
,,when coronavirus stimulus check,,,,how many people are infected with the corona virus,,,,,,,,,,,,
,,when coronavirus symptoms start,,,,How many people are infected worldwide?,,,,,,,,,,,,
,,where covid-19 antibody testing,,,,How many people are on ventilators?,,,,,,,,,,,,
,,Which are the first signals of the virus?,,,,how many people are really infected with corona virus,,,,,,,,,,,,
,,Which are the symptoms of coronavirus?,,,,How many people are sick?,,,,,,,,,,,,
,,which condition is caused by the corona virus,,,,how many people are suffering from corona virus,,,,,,,,,,,,
,,which condition is caused by the corona virus sars influenza,,,,how many people by the corona virus,,,,,,,,,,,,
,,which coronavirus causes sars,,,,How many people carry the virus?,,,,,,,,,,,,
,,which coronavirus causes the common cold,,,,How many people caught the virus,,,,,,,,,,,,
,,which coronavirus symptoms start first,,,,How many people currently have the corona virus?,,,,,,,,,,,,
,,which coronavirus test is the most accurate,,,,how many people dead from corona virus in china,,,,,,,,,,,,
,,which covid-19 antibody test is best,,,,how many people ded from corona virus,,,,,,,,,,,,
,,why is the corona virus bad,,,,how many people died by the corona virus,,,,,,,,,,,,
,,why is the corona virus dangerous,,,,how many people died from corona virus 2020,,,,,,,,,,,,
,,,,,,how many people died from the corona virus,,,,,,,,,,,,
,,,,,,How many people died from the virus?,,,,,,,,,,,,
,,,,,,how many people died in america from the corona virus,,,,,,,,,,,,
,,,,,,how many people died of corona virus,,,,,,,,,,,,
,,,,,,how many people died of the corona virus,,,,,,,,,,,,
,,,,,,How many people died so far from the Corona virus?,,,,,,,,,,,,
,,,,,,how many people died to the corona virus,,,,,,,,,,,,
,,,,,,how many people does the corona virus kill every year,,,,,,,,,,,,
,,,,,,how many people form the corona virus,,,,,,,,,,,,
,,,,,,how many people had died of the corona virus,,,,,,,,,,,,
,,,,,,how many people has the corona virus,,,,,,,,,,,,
,,,,,,how many people has the corona virus killed,,,,,,,,,,,,
,,,,,,how many people have been affected by the corona virus,,,,,,,,,,,,
,,,,,,how many people have been cured from corona virus,,,,,,,,,,,,
,,,,,,How many people have been infected with Corona virus so far?,,,,,,,,,,,,
,,,,,,How many people have been infected with covid-19?,,,,,,,,,,,,
,,,,,,how many people have been killed by corona virus,,,,,,,,,,,,
,,,,,,how many people have been killed from the corona virus,,,,,,,,,,,,
,,,,,,How many people have been reported with Corona so far?,,,,,,,,,,,,
,,,,,,How many people have been tested for corona virus,,,,,,,,,,,,
,,,,,,how many people have benn infected by the corona virus,,,,,,,,,,,,
,,,,,,how many people have come down with corona virus,,,,,,,,,,,,
,,,,,,How many people have contracted the disease worldwide?,,,,,,,,,,,,
,,,,,,How many people have corona virus,,,,,,,,,,,,
,,,,,,how many people have corona virus in china,,,,,,,,,,,,
,,,,,,how many people have corona virus in new mexico,,,,,,,,,,,,
,,,,,,How many people have Corona?,,,,,,,,,,,,
,,,,,,how many people have ded of the corona virus,,,,,,,,,,,,
,,,,,,how many people have died because of corona virus,,,,,,,,,,,,
,,,,,,How many people have died from corona virus,,,,,,,,,,,,
,,,,,,how many people have died from corona virus vs flu,,,,,,,,,,,,
,,,,,,How many people have died from corona virus?,,,,,,,,,,,,
,,,,,,How many people have died from corona?,,,,,,,,,,,,
,,,,,,How many people have died from COVID-19?,,,,,,,,,,,,
,,,,,,How many people have died from the corona virus?,,,,,,,,,,,,
,,,,,,How many people have died from the virus now?,,,,,,,,,,,,
,,,,,,how many people have died of corona virus,,,,,,,,,,,,
,,,,,,How many people have died?,,,,,,,,,,,,
,,,,,,how many people have diied from the corona virus,,,,,,,,,,,,
,,,,,,how many people have gotten corona virus so far,,,,,,,,,,,,
,,,,,,How many people have recovered from corona virus?,,,,,,,,,,,,
,,,,,,How many people have recovered from COVID-19?,,,,,,,,,,,,
,,,,,,How many people have recovered from the corona virus?,,,,,,,,,,,,
,,,,,,How many people have relapsed after testing negative from previously being infected?,,,,,,,,,,,,
,,,,,,How many people have succumbed to the virus,,,,,,,,,,,,
,,,,,,how many people have the corona virus in ny,,,,,,,,,,,,
,,,,,,how many people have the corona virus in the us,,,,,,,,,,,,
,,,,,,how many people have the corona virus this year,,,,,,,,,,,,
,,,,,,How many people have the virus in the entire world,,,,,,,,,,,,
,,,,,,how many people hve died from the corona virus,,,,,,,,,,,,
,,,,,,how many people in ca are under corona virus quaranteen,,,,,,,,,,,,
,,,,,,how many people in egypt got the corona virus,,,,,,,,,,,,
,,,,,,how many people in la have the corona virus,,,,,,,,,,,,
,,,,,,how many people in nh have the corona virus,,,,,,,,,,,,
,,,,,,how many people in the us got the corona virus,,,,,,,,,,,,
,,,,,,how many people in the us have the corona virus,,,,,,,,,,,,
,,,,,,how many people in the usa got the corona virus,,,,,,,,,,,,
,,,,,,how many people in us have corona virus,,,,,,,,,,,,
,,,,,,how many people in usa have corona virus,,,,,,,,,,,,
,,,,,,how many people in wuhan have corona virus,,,,,,,,,,,,
,,,,,,How many people recovered from Corona virus?,,,,,,,,,,,,
,,,,,,How many people worldwide have been infected thus far?,,,,,,,,,,,,
,,,,,,how many peopple have died from corona virus,,,,,,,,,,,,
,,,,,,how many pepole have died from the corona virus,,,,,,,,,,,,
,,,,,,How many persons worldwide have the corona,,,,,,,,,,,,
,,,,,,how many politicians in italy are affected with corona virus,,,,,,,,,,,,
,,,,,,how many ppl died from the corona virus,,,,,,,,,,,,
,,,,,,how many ppl have the corona virus kill,,,,,,,,,,,,
,,,,,,how many suspected dead corona virus,,,,,,,,,,,,
,,,,,,How many tests were administered?,,,,,,,,,,,,
,,,,,,how many were killed by corona virus,,,,,,,,,,,,
,,,,,,how mnay people have died from the corona virus,,,,,,,,,,,,
,,,,,,how much peopel in the usa have corona virus,,,,,,,,,,,,
,,,,,,I am curious about how many people are currently positive with covid-19.,,,,,,,,,,,,
,,,,,,I want information about the amount of people infected with corona,,,,,,,,,,,,
,,,,,,I want information on the number of cases of corona,,,,,,,,,,,,
,,,,,,I want to know how many active cases there are.,,,,,,,,,,,,
,,,,,,I want to know how many people are infected.,,,,,,,,,,,,
,,,,,,I want to know how many people infected are.,,,,,,,,,,,,
,,,,,,I want to know more about covid around the world,,,,,,,,,,,,
,,,,,,I want to know the statistics of the corona virus,,,,,,,,,,,,
,,,,,,I want to learn about the number of people infected.,,,,,,,,,,,,
,,,,,,I want to see the statistics on coronavirus,,,,,,,,,,,,
,,,,,,is corona virus deadlier than flu,,,,,,,,,,,,
,,,,,,is corona virus in africa,,,,,,,,,,,,
,,,,,,is corona virus in iowa,,,,,,,,,,,,
,,,,,,is corona virus in kentucky,,,,,,,,,,,,
,,,,,,is corona virus in new mexico,,,,,,,,,,,,
,,,,,,is corona virus in texes,,,,,,,,,,,,
,,,,,,is corona virus in thailand,,,,,,,,,,,,
,,,,,,is corona virus in the demiicom republic,,,,,,,,,,,,
,,,,,,is corona virus in the dominican republic,,,,,,,,,,,,
,,,,,,is corona virus in washington,,,,,,,,,,,,
,,,,,,is corona virus in westchesterpennsylvania,,,,,,,,,,,,
,,,,,,is corona virus is the us,,,,,,,,,,,,
,,,,,,is corona virus more deadly than flu,,,,,,,,,,,,
,,,,,,is corona virus more deadly than the flu,,,,,,,,,,,,
,,,,,,is corona virus really in san antonio,,,,,,,,,,,,
,,,,,,is corona virus really that bad,,,,,,,,,,,,
,,,,,,is corona virus really that concerning,,,,,,,,,,,,
,,,,,,is coronavirus getting better,,,,,,,,,,,,
,,,,,,is coronavirus getting worse,,,,,,,,,,,,
,,,,,,is coronavirus in africa,,,,,,,,,,,,
,,,,,,is coronavirus in ireland,,,,,,,,,,,,
,,,,,,is coronavirus in mexico,,,,,,,,,,,,
